{
  "$schema": "https://json-schema.org/draft/2020-12/schema",
  "$id": "https://schemas.cyberwave.com/simulation.hardware_qualification.v1.schema.json",
  "title": "Cyberwave Simulation Hardware Qualification",
  "description": "The hardware fingerprint an Isaac Sim worker's qualification probe records. A worker joins the Isaac pool only while its latest record has status 'pass', an RT-core NVIDIA GPU with a 16 GB card (at least 15872 MiB reported total VRAM, see MIN_ISAAC_VRAM_MIB), a resolved plant image digest (matching the expected one where the platform sets it), and a checked_at within the freshness window. There is no GPU-model list and no driver pin. The worker stores its latest record in its cloud-node metadata under 'hardware_qualification'. The schema accepts failing records so a probe can report why it failed; cyberwave_contracts.simulation.check_hardware_qualification decides whether a record qualifies, failing closed. Contains no credentials, hostnames or URLs.",
  "type": "object",
  "additionalProperties": true,
  "required": [
    "contract",
    "status",
    "probe_version",
    "checked_at",
    "gpu_model",
    "rt_cores",
    "vram_mib",
    "driver",
    "image_digest"
  ],
  "properties": {
    "contract": {
      "const": "simulation.hardware_qualification.v1"
    },
    "status": {
      "enum": [
        "pass",
        "fail"
      ],
      "description": "'pass' only when every check passed."
    },
    "probe_version": {
      "type": "string",
      "description": "Version of the qualification probe that produced this record."
    },
    "checked_at": {
      "type": "string",
      "description": "RFC 3339 UTC timestamp of the probe run. A record older than the freshness window is stale."
    },
    "gpu_model": {
      "type": "string",
      "description": "GPU model as the driver reports it, e.g. 'NVIDIA GeForce RTX 5070 Ti'."
    },
    "rt_cores": {
      "type": "boolean",
      "description": "Whether the GPU has RT cores. Isaac Sim does not run without them (e.g. A100, H100)."
    },
    "vram_mib": {
      "type": "integer",
      "minimum": 0,
      "description": "Total VRAM of the GPU assigned to Isaac workloads, in MiB."
    },
    "driver": {
      "type": "string",
      "description": "NVIDIA Linux driver version, e.g. '580.178'."
    },
    "image_digest": {
      "type": [
        "string",
        "null"
      ],
      "pattern": "^sha256:[0-9a-f]{64}$",
      "description": "Digest of the Isaac plant image the runtime probe ran. A record without one never qualifies."
    },
    "provisional": {
      "type": "boolean",
      "description": "True when a development-mode probe waived checks a production node must pass (a runtime probe that was not run). A provisional record qualifies only where the platform explicitly allows it (Cyberwave's internal development and test deployments)."
    },
    "provisional_reasons": {
      "type": "array",
      "items": {
        "type": "string"
      },
      "description": "The checks a provisional record waived."
    },
    "execution_profiles": {
      "type": "array",
      "items": {
        "enum": [
          "isaac-cpu-physics",
          "isaac-gpu-physics",
          "isaac-newton-physics"
        ]
      },
      "description": "Execution profiles whose physics the runtime probe stepped. When present, a worker qualifies only for these; when absent, for every profile."
    },
    "checks": {
      "type": "object",
      "additionalProperties": true,
      "properties": {
        "vram": {
          "enum": [
            "pass",
            "fail",
            "skipped"
          ]
        },
        "driver": {
          "enum": [
            "pass",
            "fail",
            "skipped"
          ],
          "description": "nvidia-smi reported a valid driver version."
        },
        "runtime_probe": {
          "enum": [
            "pass",
            "fail",
            "skipped"
          ],
          "description": "NVIDIA compatibility checker, headless Kit start, RTX render, physics steps, encode and clean shutdown."
        }
      }
    },
    "failures": {
      "type": "array",
      "items": {
        "type": "string"
      },
      "description": "Human-readable reasons for a 'fail' status."
    }
  }
}
